{
  "schema_version": "0.2.0",
  "record_id": "builder-v01-layered-calibration",
  "instrument_shape": "tabular_mock_tool",
  "migration_freeze": {"binding_id": "migration-freeze", "path": "pilots/procedure-package-released-validation/layered-migration-freeze.json", "sha256": "3368d5b491e97f9f390b406ab9d3474d42afc11c4701989705304bac695e556b", "purpose": "Pre-implementation migration matrix"},
  "source_bindings": [
    {"binding_id": "v01-fixture", "path": "schemas/fixtures/procedure-package-conformance.json", "sha256": "c78dc66893d23d50a7c2ca811203cde9060010cf583daf496e19341b88a0b7af", "purpose": "Unchanged builder-authored v0.1 calibration package"}
  ],
  "claim_limits": {"internal_calibration_only": true, "unsupported": ["expert approval", "professional correctness", "agent capability", "safety", "production fitness", "deployment readiness"]},
  "package_layer": {
    "inventory": {"evidence_id": "builder-inventory", "status": "complete", "reason": "The v0.1 fixture contains an exact field, tool, oracle, comparator, procedure, and trial inventory.", "provenance_refs": ["v01-fixture"]},
    "versions": {"evidence_id": "builder-versions", "status": "complete", "reason": "The v0.1 fixture freezes generator, loader, runtime, and oracle component versions and hashes.", "provenance_refs": ["v01-fixture"]},
    "roles": [
      {"role": "public_input", "surface": "public_task", "evidence": {"evidence_id": "builder-role-public", "status": "complete", "reason": "Public input fields are explicitly typed.", "provenance_refs": ["v01-fixture"]}},
      {"role": "hidden_evidence", "surface": "private_evaluator", "evidence": {"evidence_id": "builder-role-hidden", "status": "complete", "reason": "Hidden evidence fields are explicitly typed and withheld.", "provenance_refs": ["v01-fixture"]}},
      {"role": "tool_result", "surface": "scored_runtime", "evidence": {"evidence_id": "builder-role-tool", "status": "complete", "reason": "Tool-only result fields are explicitly typed.", "provenance_refs": ["v01-fixture"]}},
      {"role": "scored_endpoint", "surface": "scored_runtime", "evidence": {"evidence_id": "builder-role-endpoint", "status": "complete", "reason": "Endpoint fields are restricted to final artifacts.", "provenance_refs": ["v01-fixture"]}},
      {"role": "audit_metadata", "surface": "audit_only", "evidence": {"evidence_id": "builder-role-audit", "status": "complete", "reason": "Audit metadata fields have an audit-only surface.", "provenance_refs": ["v01-fixture"]}},
      {"role": "prohibited_oracle", "surface": "private_evaluator", "evidence": {"evidence_id": "builder-role-oracle", "status": "complete", "reason": "Oracle fields are typed private and excluded from tool returns.", "provenance_refs": ["v01-fixture"]}}
    ],
    "access_boundary": {"evidence": {"evidence_id": "builder-access", "status": "complete", "reason": "The semantic validator enforces role surfaces and rejects oracle-bearing tool returns.", "provenance_refs": ["v01-fixture"]}, "enforced": true},
    "answer_bearing_tools": {"evidence": {"evidence_id": "builder-answer-audit", "status": "complete", "reason": "All declared tool returns are audited against endpoint and oracle roles.", "provenance_refs": ["v01-fixture"]}, "detected": false},
    "prohibited_oracles": [{"oracle_id": "builder-oracle", "binding_ref": "v01-fixture", "scored_run_access": "prohibited"}]
  },
  "environment_layer": {
    "adapter_identity": {"evidence_id": "builder-adapter", "status": "complete", "reason": "The v0.1 loader and runtime identities are frozen.", "provenance_refs": ["v01-fixture"]},
    "runtime_identity": {"evidence_id": "builder-runtime", "status": "complete", "reason": "The mock-tool runtime has a version and content hash.", "provenance_refs": ["v01-fixture"]},
    "shape_contract": {"evidence_id": "builder-shape", "status": "complete", "reason": "The table contract binds metadata columns, loaded columns, and row counts.", "provenance_refs": ["v01-fixture"]},
    "deterministic_replay": {"evidence_id": "builder-replay", "status": "complete", "reason": "Repeated replay digests agree under frozen seed and time.", "provenance_refs": ["v01-fixture"]},
    "replay_deterministic": true
  },
  "trial_layer": {
    "procedure_observation": {"evidence_id": "builder-procedure", "status": "complete", "reason": "Five planted traces cover clauses, relations, gates, fallback, and order.", "provenance_refs": ["v01-fixture"]},
    "final_state_observation": {"evidence_id": "builder-artifact", "status": "complete", "reason": "Each planted trial contains a final artifact rather than a trace-derived endpoint.", "provenance_refs": ["v01-fixture"]},
    "endpoint_observation": {"evidence_id": "builder-endpoint", "status": "complete", "reason": "Typed comparator outcomes replay from the final artifacts.", "provenance_refs": ["v01-fixture"]},
    "alternative_inventory": {"evidence_id": "builder-alternatives", "status": "complete", "reason": "Canonical and hold alternatives are declared before trial scoring.", "provenance_refs": ["v01-fixture"]},
    "endpoint_source": "final_artifact",
    "declared_alternative_ids": ["canonical", "hold"],
    "accepted_alternative_ids": ["canonical", "hold"],
    "procedure_result": "pass",
    "endpoint_result": "pass"
  },
  "reported_layers": {"package": "pass", "environment": "pass", "trial": "pass"},
  "claims": [
    {"layer": "package", "status": "supported", "statement": "The exact builder-authored fixture passes package-layer internal calibration checks."},
    {"layer": "environment", "status": "supported", "statement": "The exact builder-authored mock runtime passes deterministic replay calibration."},
    {"layer": "trial", "status": "supported", "statement": "The five exact planted cases replay their builder-authored trial outcomes."}
  ]
}
